{"schema_version":"1.0","repository":"Jagadeeshck/DataObs","commit_sha":"087b8c22f4ebad273ed2299cb208b87e9501a06b","workflow_run_id":null,"workflow_run_url":null,"started_at":"2026-07-21T00:00:00Z","completed_at":"2026-07-21T00:00:00Z","versions":{"elasticsearch":"9.5.5"},"profiles":["core"],"capabilities":{},"security":{"status":"not_run"},"browser":{"status":"not_run"},"migrations":{"status":"not_run"},"redaction":{"status":"passed","sentinels_found":0},"artifacts":[]}
